Timestamp,"Please specify an area to go, should be same for the whole group (for example, Chinatown, New York, NY).",What is your desired price level?,What categories of food would you like to try?,What's your minimum accepted rating level?,Do you need the restaurant to be liked by vegetarians? ,Accepts Credit Cards?,Do you need Wi-Fi?
12/2/18 0:19,Little Italy,$$,"Italian, Wine Bars",4,yes,No,no
12/2/18 0:19,"Little Italy, NY",$$$,"Seafood, Wine Bars",3,no,Yes,yes
12/2/18 0:19,Little Italy,$$$$,"Italian, Seafood, Noodles, Wine Bars",5,yes,Yes,yes
12/2/18 0:20,Columbia University,$,"American (New), Japanese, Chinese, Korean, Malaysian, Seafood, Noodles",3,no,No,yes
12/2/18 0:20,"New York University, New York, NY",$,"American (New), Fast Food, Barbeque",3,no,Yes,yes
12/2/18 0:21,"Chinatown, New York, NY",$$,"Chinese, Cantonese, Malaysian, Thai, Asian Fusion",3,no,Yes,yes